policy,status,requirement
credential_source,env_file_or_environment_only,INTRINIO_API_KEY must be supplied outside committed files
credential_disclosure,forbidden,secret values must never be printed or committed
prior_key_rotation,required_before_query,previous Intrinio key exposure requires rotated/replaced key before first query
credential_preflight,required_before_query,presence-only check may inspect INTRINIO_API_KEY without network call
account_page_access,user_only,agent does not access account page or retrieve keys
