provider,component_fit,official_source_url,what_it_solves,what_it_does_not_solve,status
Norgate Data,Daily Momentum;Daily Mean Reversion,https://norgatedata.com/data-content-tables.php,Survivor-aware daily active and delisted equities plus historical constituents,No intraday order flow and no catalyst direction,admissible_for_daily_subset
CRSP via WRDS,Daily Momentum;Daily Mean Reversion,https://wrds-www.wharton.upenn.edu/,Institutional survivor-aware prices returns delisting history and identifiers,No native order book and no biotech catalyst direction,admissible_if_access_exists
WRDS TAQ,Dollar-Bar Microstructure,https://wrds-www.wharton.upenn.edu/,Intraday trades and quotes for academic market microstructure research,Does not provide biotech catalyst direction by itself,candidate_for_intraday
Databento TotalView-ITCH,Dollar-Bar Microstructure,https://databento.com/equities,L2/L3 order-book schemas and intraday equities data,Does not provide survivor-free fundamental/catalyst direction by itself,candidate_for_intraday
NYSE Historical TAQ/OpenBook,Dollar-Bar Microstructure,https://www.nyse.com/market-data/historical,Historical order-by-order and order-book reconstruction products for NYSE markets,Venue-specific and not a complete catalyst source,candidate_for_intraday
FactSet PIT Estimates,Catalyst/PEAD direction,https://www.factset.com/marketplace/catalog/product/factset-estimates-point-in-time-consensus,Point-in-time consensus estimates for look-ahead-safe surprise calculation,Does not provide order-book reconstruction,candidate_for_earnings_direction
LSEG I/B/E/S,Catalyst/PEAD direction,https://www.lseg.com/en/data-analytics/financial-data/company-data/ibes-estimates,Analyst estimates consensus actuals and historical estimates,Does not provide order-book reconstruction,candidate_for_earnings_direction
S&P Capital IQ / Visible Alpha / Compustat,Catalyst/PEAD direction,https://www.spglobal.com/market-intelligence/en/solutions/products/estimates,Point-in-time fundamentals and estimates stack,Does not provide order-book reconstruction,candidate_for_earnings_direction
Citeline / BioMedTracker,Catalyst biotech direction,https://www.citeline.com/en/,Clinical-trial and drug-development intelligence useful for biotech catalyst context,Does not provide survivor-aware OHLCV/order-book data,candidate_for_biotech_catalysts
