requirement,threshold,rationale
provider_call_count,<=5,Bound provider access before execution.
min_seconds_between_calls,>=13,Respect observed free-tier pacing limits.
detail_success_count,>=5,All continuation details calls should return usable results.
list_date_present_count,>=5,Need listing dates for all remaining sampled tickers.
raw_payload_retained,false,Avoid retaining raw provider payload.
market_data_downloaded,false,No price data in this continuation.
backtest_performed,false,No strategy trial in this continuation.
broad_universe_backtest_allowed,false,Continuation does not authorize broad PIT backtests.
