input_name,previous_status,new_status,blocks_execution,resolution_detail
explicit_user_execution_approval,missing,not_granted,yes,User has not explicitly approved actual execution.
final_execution_module,dry_only_implemented,real_runner_gated,yes,Real-run gate report exists but execution path remains blocked and non-executing.
final_output_directory,placeholder,specified_not_created,yes,Output directory path specified but not created for execution.
trial_ledger_entry,missing,planned_not_created,yes,Ledger entry planned but not consumed/created as run artifact.
provider_credentials_check,presence_check_implemented_not_run,local_check_blocked_missing_required_env,yes,Local env check found missing DATABENTO_API_KEY and POLYGON_API_KEY; no secret disclosure or provider query.
command_dry_review,reviewed_dry_only,reviewed_gated_real_runner,yes,Gated real-run command surface reviewed; still no executable approval.
